[
  { "id": "misc_gold", "name": "Gulden", "description": "Srebrna moneta z wybitym gryfem. Waluta Kresów.", "category": "currency", "value": 1, "weight": 0.01, "icon": "misc_gold", "stackable": true, "max_stack": 99999 },
  { "id": "misc_arrow", "name": "Strzała", "description": "Zwykła strzała z żelaznym grotem.", "category": "ammo", "value": 1, "weight": 0.05, "icon": "misc_arrow", "stackable": true, "max_stack": 100 },
  { "id": "misc_lockpick_iron", "name": "Żelazny Wytrych", "description": "Prosty wytrych do prostych zamków. Łamliwy.", "category": "lockpick", "value": 5, "weight": 0.1, "icon": "misc_lockpick_iron", "stackable": true, "max_stack": 20, "lockpick_level": 1 },
  { "id": "misc_lockpick_steel", "name": "Stalowy Wytrych", "description": "Mocniejszy wytrych do lepszych zamków.", "category": "lockpick", "value": 20, "weight": 0.15, "icon": "misc_lockpick_steel", "stackable": true, "max_stack": 15, "lockpick_level": 2 },
  { "id": "misc_lockpick_master", "name": "Mistrzowski Wytrych", "description": "Najwyższej jakości. Otwiera prawie wszystko.", "category": "lockpick", "value": 80, "weight": 0.15, "icon": "misc_lockpick_master", "stackable": true, "max_stack": 10, "lockpick_level": 3 },
  { "id": "misc_key_guard_tower", "name": "Klucz do Wieży Straży", "description": "Ciężki, żelazny klucz do wieży w Grodzie Straży.", "category": "key", "value": 0, "weight": 0.3, "icon": "misc_key_guard_tower", "quest_item": true },
  { "id": "misc_key_free_cache", "name": "Klucz do Skrytki Wolnych", "description": "Mały, mosiężny klucz. Otwiera skrytkę w Wolnych Chatach.", "category": "key", "value": 0, "weight": 0.1, "icon": "misc_key_free_cache", "quest_item": true },
  { "id": "misc_quest_letter", "name": "List", "description": "Zapieczętowany list. Adresowany do kogoś w Grodzie Straży.", "category": "quest_item", "value": 0, "weight": 0.01, "icon": "misc_quest_letter", "quest_item": true },
  { "id": "misc_quest_artifact", "name": "Stary Artefakt", "description": "Kamienna figurka o nieznanym przeznaczeniu. Pulsuje słabym światłem.", "category": "quest_item", "value": 0, "weight": 0.5, "icon": "misc_quest_artifact", "quest_item": true },
  { "id": "misc_quest_herb_packet", "name": "Ziołowa Wiązka", "description": "Pęczek suszonych ziół. Ktoś na pewno zapłaci za nie grosza.", "category": "quest_item", "value": 0, "weight": 0.2, "icon": "misc_quest_herb_packet", "quest_item": true },
  { "id": "misc_skins_wolf", "name": "Wilcza Skóra", "description": "Świeżo ściągnięta skóra wilczura. Można sprzedać lub wyprawić.", "category": "trophy", "value": 8, "weight": 1.0, "icon": "misc_skins_wolf", "source_monster": "monster_grey_wolf" },
  { "id": "misc_skins_boar", "name": "Dzicza Skóra", "description": "Gruba, twarda skóra dzika. Dobra na rękawice.", "category": "trophy", "value": 6, "weight": 1.5, "icon": "misc_skins_boar", "source_monster": "monster_forest_boar" },
  { "id": "misc_trophy_mutant_eye", "name": "Oko Mutanta", "description": "Galaretowate, świecące oko. Zielarka zapłaci za nie.", "category": "trophy", "value": 15, "weight": 0.3, "icon": "misc_trophy_mutant_eye", "source_monster": "monster_mutant" },
  { "id": "misc_trophy_wyrm_scale", "name": "Łuska Piaszczaka", "description": "Twarda jak kamień łuska. Można nią wzmocnić zbroję.", "category": "trophy", "value": 25, "weight": 2.0, "icon": "misc_trophy_wyrm_scale", "source_monster": "monster_sand_wyrm" },
  { "id": "misc_quest_medallion", "name": "Medalion Rodowy", "description": "Stary, srebrny medalion z wygrawerowanym herbem. Cenny dla kogoś.", "category": "quest_item", "value": 0, "weight": 0.1, "icon": "misc_quest_medallion", "quest_item": true }
]
